<?xml version="1.0" encoding="UTF-8"?>
<people xmlns:xsi="http://www.w3.org/2001/XMLSchema-instance" xsi:noNamespaceSchemaLocation="../schema.xsd">
	<person>
		<firstname>Jozef</firstname>
		<lastname>Mrkva</lastname>
		<email>jozko.mrkva@gmail.com</email>
		<email type="osobní">jozko.mrkva@gmail.com</email>
		<phone>00421 915 651 818</phone>
		<phone type="pracovní">00421 559 854 478</phone>
		<link >www.dunco.sk</link>
		<link type="jiná">www.google.sk</link>
		<other>
			<service>Skype</service>
			<id>StratilSomPsa</id>
		</other>
		<address>
			<street>Slamkova</street>
			<number>5</number>
			<postCode>94907</postCode>
			<city>Nitra</city>
		</address>
		<note>Pozn8mka na
		
				viacero 
				riadkov.
		</note>
		<note>Pozn8mka na jeden riadok.
		</note>
	</person>
</people>
